<?xml version="1.0" encoding="UTF-8"?>
<!-- Óscar Martín-Castaño Carrillo-->
<productos xmlns:xsi="http://www.w3.org/2001/XMLSchema-instance" xsi:noNamespaceSchemaLocation="./ej5-OscarXSD.xsd">
   <producto codigo="12345">
      <descripcion>Tipo A</descripcion>
      <cantidad>3</cantidad>
   </producto>
   <producto codigo="98765">
      <descripcion>Tipo B</descripcion>
      <cantidad>5</cantidad>
   </producto>
   <producto codigo="54321">
      <descripcion>Tipo C</descripcion>
      <cantidad>2</cantidad>
   </producto>
</productos>